<?xml version="1.0" encoding="UTF-8"?>
<?xml-stylesheet type="text/xsl" href="../schematEksportuDziennika.xsl"?>
<Ksiega
                 xmlns:xsi="http://www.w3.org/2001/XMLSchema-instance"
                 xsi:noNamespaceSchemaLocation="../schematKsiegi.xsd">
    <Wychowankow>
    <NazwaPlacowki>Młodzieżowy Ośrodek Wychowawczy numer 1</NazwaPlacowki>
    <AdresPlacowki>
        <KodPocztowy>01-123</KodPocztowy>
        <Miejscowosc>Warszawa</Miejscowosc>
        <Ulica>Ogrodowa</Ulica>
        <NumerDomu>1</NumerDomu>
        <NumerLokalu></NumerLokalu>
    </AdresPlacowki>
    <Wojewodztwo>mazowieckie</Wojewodztwo>
    <Gmina>Warszawa Wola</Gmina>
    <DataZalozeniaEwidencji>01.09.2020 r.</DataZalozeniaEwidencji>
    <Wychowankowie>
        <Wychowanek id="1">
            <Numer>1</Numer>
            <Imie>Anna</Imie>
            <Nazwisko>Nowak</Nazwisko>
            <DataUrodzenia>2000-05-05</DataUrodzenia>
            <MiejsceUrodzenia>Gdańsk</MiejsceUrodzenia>
            <Pesel>001291019122</Pesel>
            <Adres>
                <KodPocztowy>00-123</KodPocztowy>
                <Miejscowosc>Warszawa</Miejscowosc>
                <Ulica>Aleje Jerozolimskie</Ulica>
                <NumerDomu>1</NumerDomu>
                <NumerLokalu>3</NumerLokalu>
            </Adres>
            <Rodzice>
                <Rodzic id="1">
                <Imie>Wiktor</Imie>
                <Nazwisko>Nowak</Nazwisko>
                <Adres>
                    <KodPocztowy>00-123</KodPocztowy>
                    <Miejscowosc>Warszawa</Miejscowosc>
                    <Ulica>Aleje Jerozolimskie</Ulica>
                    <NumerDomu>2</NumerDomu>
                    <NumerLokalu>4</NumerLokalu>
                </Adres>
                </Rodzic>
                <Rodzic id="2">
                    <Imie>Anna</Imie>
                    <Nazwisko>Nowak</Nazwisko>
                    <Adres>
                        <KodPocztowy>00-123</KodPocztowy>
                        <Miejscowosc>Warszawa</Miejscowosc>
                        <Ulica>Aleje Jerozolimskie</Ulica>
                        <NumerDomu>2</NumerDomu>
                        <NumerLokalu>4</NumerLokalu>
                    </Adres>
                </Rodzic>
            </Rodzice>
            <DataPrzyjeciaWychowankaDoPlacowki>01.12.2014 r.</DataPrzyjeciaWychowankaDoPlacowki>
            <DataSkresleniaZListyWychowankow>10.09.2019 r.</DataSkresleniaZListyWychowankow>
            <PrzyczynaSkresleniaZListyWychowankow>Przeprowadzka</PrzyczynaSkresleniaZListyWychowankow>
            <NazwaPlacowkiDoKtorejWychowanekZostalPrzeniesiony>Młodzieżowy Ośrodek Wychowawczy numer 2 w Warszawie</NazwaPlacowkiDoKtorejWychowanekZostalPrzeniesiony>
            <AdresDoKtorejWychowanekZostalPrzeniesiony>
                <KodPocztowy>01-213</KodPocztowy>
                <Miejscowosc>Warszawa</Miejscowosc>
                <Ulica>Nowogrodzka</Ulica>
                <NumerDomu>12</NumerDomu>
                <NumerLokalu></NumerLokalu>
            </AdresDoKtorejWychowanekZostalPrzeniesiony>
        </Wychowanek>
        <Wychowanek id="2">
            <Numer>2</Numer>
            <Imie>Marian</Imie>
            <Nazwisko>Nowakowski</Nazwisko>
            <DataUrodzenia>2000-05-05</DataUrodzenia>
            <MiejsceUrodzenia>Warszawa</MiejsceUrodzenia>
            <NazwaINumerDokumentuPotwierdzajacegoTozsamosc>Dowód osobisty AZA 1234</NazwaINumerDokumentuPotwierdzajacegoTozsamosc>
            <Adres>
                <KodPocztowy>00-170</KodPocztowy>
                <Miejscowosc>Warszawa</Miejscowosc>
                <Ulica>Marszałkowska</Ulica>
                <NumerDomu>1</NumerDomu>
                <NumerLokalu>3</NumerLokalu>
            </Adres>
            <DataPrzyjeciaWychowankaDoPlacowki>10.12.2016 r.</DataPrzyjeciaWychowankaDoPlacowki>
        </Wychowanek>
    </Wychowankowie>
    </Wychowankow>
</Ksiega>
